title,messages,,,,,,,,,,,,,,,,,,
,当然遗憾的不只是游戏啦，是每次开局前的那几秒我切出来看微信却没有你的回复，是昨天评论的你的微博今天看见你回复了别人，是返回游戏以后被断的连胜，是游戏和生活都不如意，是别人都有的疯狂星期四却没人请我吃。,,,,,,,,,,,,,,,,,,
,"暗恋五年的人发朋友圈官宣了 我整夜买醉 哭累了
听说酸奶和炸鸡一起吃会中毒
酸奶我有了
你能不能帮我买份炸鸡
听说肯德基的毒性最强",,,,,,,,,,,,,,,,,,
,现在距离高考仅有12天了，但是我现在仍然浑浑噩噩，整天抱着个手机，一点学习的样子的没有。从去年九月份开始，我这两个学期的状态远不如之前了，我知道高考的重要性，也知道高考意味着什么，但是我的确无法强迫自己学习。哎，还有12天，我该怎么办啊，我现在一点都没有高三学生应该有的样子，希望群里的好心人帮帮我，让我重新有动力去学习，为了一个学生的未来，请v我50。,,,,,,,,,,,,,,,,,,
,我托了关系才进了这个群，聊天跟不上，不聊又怕被踢，聊了又没人理，所以整天一个人自言自语，我都快得抑郁症了，还请活泼开朗阳光的姐姐加我，我们一起去苏州吃螃蟹，一起去青岛吹海风，一起去柳州吃螺蛳粉，一起去迪士尼看烟花，一起去沂蒙山看日出日落，去新疆吃烤串儿，去北京吃烤鸭，去东北吃鸡架，去重庆吃火锅，去陕西吃泡馍，去武汉吃热干面，然后再到长沙喝茶颜悦色，顺利的话我们会结婚，我们会有一个灿烂的余生，不顺利的话今天疯狂星期四v50请我吃一顿肯德基。,,,,,,,,,,,,,,,,,,
,有没有要找工作的？我这边内推入职，朝九晚六，做五休二，全国都有分公司。前三个月试用期每个月8000块，满三个月转正月薪26000，一年后给你买车，两年后给你买房。有意者点击头像私聊，并交50块押金。,,,,,,,,,,,,,,,,,,
,"黄桃罐头保质期是15个月，可乐要在打开后24小时喝掉，吻痕大概一周就能消失。两个人在一起三个月才算过了磨合期，似乎一切都有期限。这样多无趣，我还是喜欢一切没有规律可循的事情。
比方说现在，你突然转给我50块，说今天是肯德基疯狂星期四。",,,,,,,,,,,,,,,,,,
,被群主欺骗三年，说进群就分配富婆情缘，但是时至今日，群里面还都是一群和我一样没人要的骚话网友，我很心痛天天以泪洗面，最近没有怎么哭了，慢慢变好了......以前有多快乐，现在就有多难过。从听到分配情缘的快乐，到被欺骗的委屈，用真心换群主的欺瞒，很痛也很难。今天是肯德基疯狂星期四，v我 60，抚慰我支离破碎的心。别问我为啥比他们多 10，我贪心想多喝杯杨枝甘露。,,,,,,,,,,,,,,,,,,
,今天是高启强被抓的第不知道多少天，我强哥辛辛苦苦奋斗二十年，最后亲人离世，老婆也被人谋害，辛辛苦苦一手养大的儿子女儿还都是逆子。越想越心痛，越想越难过，今天是肯德基疯狂星期四，v我27.8，我不吃肯德基，我吃两份麦当劳13.9随心选。 ,,,,,,,,,,,,,,,,,,
,"小时候听老人常说“冬吃汉堡夏吃姜，不用大夫开药方”，所有汉堡中香辣鸡腿堡最正宗。
我们的老祖宗认为冬季是个寒冷的季节，所以要在家里多吃汉堡为未来一年的生活打下好基础。这是我们的宝贵传统，一定要好好保护不能丢掉，现在很多年轻人已经不知道这层寓意了，很悲哀。今天是肯德基疯狂星期四，v我50，我们一起留下宝贵传统文化。",,,,,,,,,,,,,,,,,,
,失业了，最近没有怎么哭了，我现在慢慢变好了吧！以前有多快乐，现在就有多难过。从人间烟火的日常，到红着眼睛告别，消失在彼此的世界里，很痛，也很难。今天是肯德基疯狂星期四，v我50，抚慰我支离破碎的心。,,,,,,,,,,,,,,,,,,
,从进群的那天起 我就关注你了 经常翻你朋友圈 不善言辞的我 不敢和你聊天 怕打扰你 但是 我很确信这是喜欢 这条微信我设置了仅你可见 你要同意你就拍一拍我 V我50 想今天和你一起过肯德基疯狂星期四.,,,,,,,,,,,,,,,,,,
,说句实在话，离婚这么多年，竟然在微信遇到你了。你过得挺好我也就放心了。孩子上四年级了，成绩一直都很好，连续三年拿班上第一名，就是性格像你，一出事就逃避，孩子总问妈妈什么时候来参加家长会。有时间就来看看孩子吧，多陪陪孩子，孩子今天想吃肯德基，因为今天是肯德基疯狂星期四，微信我六十，我带孩子吃吮指原味鸡。我在说谁，自己心里清楚。,,,,,,,,,,,,,,,,,,
,最近越来越期待夜晚了，因为白天都没什么机会和你说话，只能憋到晚上和你说句晚安，但你可别小看这两个字，可包含着我今天清晨见到的阳光，中午看到的白云，傍晚遇见的微风，包含着我一天想对你说的话，说了这么多，你听得到吗，其实我在说，今天是肯德基疯狂星期四，v我50抚慰我支离破碎的心，如果你想让我开心点，v我100我也吃得完。,,,,,,,,,,,,,,,,,,
